{
  "schema": "drone-ptz-metadata/1",
  "type": "metadata_tick",
  "session_id": "session-cam_01-2025-12-20T12:00:00Z",
  "camera_id": "cam_01",
  "ts_unix_ms": 1730000000123,
  "ts_mono_ms": 123456789,
  "frame_index": 1,
  "space": "source",
  "frame_size": { "w": 1280, "h": 720 },
  "selected_target_id": null,
  "tracking_phase": "idle",
  "ptz": {
    "control_mode": "onvif",
    "active": false,
    "cmd": { "pan": 0.0, "tilt": 0.0, "zoom": 0.0 }
  },
  "tracks": []
}
